{
  "schema_version": "1",
  "run_id": "entity-read-by-id-20260808-183906-000000",
  "timestamp": "2026-08-08T19:19:13Z",
  "scenario": "entity-read-by-id",
  "tool": "wrk",
  "env_ref": "/home/bench/exeris-benchmarks/runtime/drivers/env/spring-runtime-on-exeris-pure-native.env",
  "transport_mode": "loopback-h1",
  "target": {
    "tier": "community",
    "repo": "spring-on-exeris-pure-native",
    "protocol": "h1",
    "mode": "pure",
    "commit_sha": "be2330ffa80abd27c6da34df31bc6c19146aa6de",
    "build_provenance": {
      "artifact_path": "/home/bench/exeris-benchmarks/targets/exeris-spring-runtime-app-pure-native/target/spring-benchmark-app-pure-native-1.0.0-SNAPSHOT.jar",
      "artifact_sha256": "948096568b80ad8d05a9f2f22f8e0ac846f79acef48e924439e184b638659edc"
    }
  },
  "run_config": {
    "duration_seconds": 900,
    "warmup_seconds": 300,
    "threads": 4,
    "connections": 128,
    "contract_id": "fixed_contract_cross_runtime_h1_v2",
    "protocol_mode": "h1",
    "transport_mode": "loopback-h1",
    "track_id": "track-ba-01",
    "pair_id": "entity-read-by-id-fixed_contract_cross_runtime_h1_v2-spring-on-exeris-comp-native__spring-on-exeris-pure-native",
    "pair_order": "ba",
    "ab_ba_orders_completed": [
      "ab",
      "ba"
    ],
    "pair_completion_evidence": {
      "invocation_order": "ba",
      "target_slot": "target-a",
      "completion_marker_utc": "2026-08-08T19:19:13Z",
      "completed_orders": [
        "ab",
        "ba"
      ]
    },
    "jvm_class": "jvm",
    "mode": "pure",
    "driver": {
      "mode": "closed",
      "offered_rps": 0,
      "rate_attainment_pct": 0,
      "note": "closed = wrk at saturation: throughput and resource metrics valid, percentiles are queue-depth/throughput. open = wrk2 at a fixed arrival rate: percentiles are service time."
    },
    "payload_size_bytes": 1024,
    "drift_snapshot": {
      "required_metadata_present": true,
      "max_latency_drift_pct": 0,
      "observed_latency_drift_pct": 0,
      "max_throughput_drift_pct": 0,
      "observed_throughput_drift_pct": 0
    },
    "metadata": {
      "jdk_vendor": "Eclipse Adoptium",
      "jdk_version": "26.0.1",
      "benchmark_tool_version": "wrk debian/4.1.0-4build2 [epoll] Copyright (C) 2012 Will Glozer",
      "jvm_flags": [
        "jvm-defaults-no-explicit-launcher-flags"
      ],
      "hardware_profile": "perf-box-amd64",
      "backend_network_mode": "host",
      "scenario_id": "entity-read-by-id",
      "target_classification": "runtime-comparative"
    },
    "pinned_versions": {
      "jdk_version": "26.0.1",
      "benchmark_tool_version": "wrk debian/4.1.0-4build2 [epoll] Copyright (C) 2012 Will Glozer",
      "target_commit_sha": "be2330ffa80abd27c6da34df31bc6c19146aa6de"
    },
    "actual_versions": {
      "jdk_version": "26.0.1",
      "benchmark_tool_version": "wrk debian/4.1.0-4build2 [epoll] Copyright (C) 2012 Will Glozer",
      "target_commit_sha": "be2330ffa80abd27c6da34df31bc6c19146aa6de"
    },
    "target_contract": {
      "target_id": "spring-on-exeris-pure-native",
      "tier": "community",
      "protocol_mode": "h1",
      "launcher_mode": "external",
      "env_file": "/home/bench/exeris-benchmarks/runtime/drivers/env/spring-runtime-on-exeris-pure-native.env",
      "profile_id": "spring-on-exeris-pure-native",
      "compose_file": "",
      "jar_path": "",
      "health_url": "http://localhost:9006/health"
    },
    "resource_metrics": {
      "sample_count": 857,
      "cpu_time_seconds": 2776.24,
      "cpu_util_percent_of_one_core": 308.47,
      "avg_cores_used": 3.0847,
      "host_logical_cpus": 16,
      "cpu_util_percent_of_host_total": 19.28,
      "vmrss_kb_min": 1125476,
      "vmrss_kb_max": 1130452,
      "vmrss_kb_avg": 1128478,
      "vmsize_kb_min": 5940172,
      "vmsize_kb_max": 5940172,
      "vmsize_kb_avg": 5940172,
      "vmhwm_kb_max": 1130452,
      "threads_min": 44,
      "threads_max": 46,
      "threads_avg": 44.11,
      "smaps_rss_kb_min": 1125476,
      "smaps_rss_kb_max": 1130452,
      "smaps_rss_kb_avg": 1128478,
      "cgroup_memory_current_kb_min": 5418912,
      "cgroup_memory_current_kb_max": 5439360,
      "cgroup_memory_current_kb_avg": 5431248,
      "rss_kb_min": 1125476,
      "rss_kb_max": 1130452,
      "rss_kb_avg": 1128478,
      "jvm_memory_breakdown": {
        "jcmd_available": true,
        "jcmd_heap_info_succeeded": true,
        "heap_metrics_present": false,
        "breakdown_valid": true,
        "breakdown_note": "NMT breakdown present; heap_committed_kb backfilled from NMT after partial GC.heap_info parse.",
        "heap_used_kb": 0,
        "heap_committed_kb": 1310720,
        "heap_max_kb": 0,
        "native_total_committed_kb": 1505222,
        "native_total_reserved_kb": 2855346,
        "native_java_heap_committed_kb": 1310720,
        "offheap_kb_estimate": 194502,
        "heap_plus_offheap_kb_estimate": 194502,
        "offheap_estimate_source": "nmt_minus_java_heap",
        "nmt_enabled": true
      }
    },
    "jfr_capture": {
      "pid": "2528806",
      "jcmd_available": true,
      "check_ok": true,
      "recording_detected": true,
      "dump_attempted": true,
      "dump_success": true,
      "stop_attempted": true,
      "stop_success": true,
      "stop_recording_name": "spring_on_exeris_pure_native_20260808_183906",
      "jfr_file": "results/raw/entity-read-by-id/20260808T151608Z-purenative-vs-compnative-n3/repeat02/heavy/1-purenative-vs-compnative/run01/ba/target-a/target-spring-on-exeris-pure-native-20260808-183906.jfr",
      "note": ""
    },
    "runtime_log": {
      "launcher_mode": "external",
      "env_file": "/home/bench/exeris-benchmarks/runtime/drivers/env/spring-runtime-on-exeris-pure-native.env",
      "log_path": "/tmp/exeris-spring-on-exeris-pure-native-9006.log",
      "external_jar_path": "targets/exeris-spring-runtime-app-pure-native/target/spring-benchmark-app-pure-native-1.0.0-SNAPSHOT.jar",
      "resolved_jar_path": "/home/bench/exeris-benchmarks/targets/exeris-spring-runtime-app-pure-native/target/spring-benchmark-app-pure-native-1.0.0-SNAPSHOT.jar",
      "jar_exists": true,
      "jar_sha256": "948096568b80ad8d05a9f2f22f8e0ac846f79acef48e924439e184b638659edc",
      "jar_size_bytes": 32498929,
      "jar_mtime_utc": "2026-08-08T15:15:21Z",
      "copied": true,
      "output_file": "results/raw/entity-read-by-id/20260808T151608Z-purenative-vs-compnative-n3/repeat02/heavy/1-purenative-vs-compnative/run01/ba/target-a/target-runtime.log",
      "note": "runtime log copied"
    },
    "jfr_start": {
      "pid": "2528806",
      "jcmd_available": true,
      "start_attempted": true,
      "start_success": true,
      "recording_already_present": false,
      "recording_name": "spring_on_exeris_pure_native_20260808_183906",
      "note": "recording started"
    }
  },
  "metrics": {
    "throughput_rps": 12768.13,
    "latency_p50_us": 9980.000000,
    "latency_p75_us": 10860.000000,
    "latency_p90_us": 11870.000000,
    "latency_p95_us": 12630.000000,
    "latency_p99_us": 14390.000000,
    "error_rate_pct": 0.0000,
    "total_requests": 11492410,
    "total_errors": 0,
    "socket_errors": {
      "connect": 0,
      "read": 0,
      "write": 0,
      "timeout": 0,
      "total": 0
    },
    "failed_requests_total": 0,
    "failed_request_rate_pct": 0.0000,
    "latency_p999_us": 0
  },
  "claim_scope": "comparison_eligible",
  "runner_status": "success",
  "final_reason": "ok",
  "reproducibility_status": "complete"
}
