{
  "schema_version": "1",
  "run_id": "entity-read-by-id-20260722-213555-000000",
  "timestamp": "2026-07-22T21:42:21Z",
  "scenario": "entity-read-by-id",
  "tool": "wrk",
  "env_ref": "/home/bench/exeris-benchmarks/runtime/drivers/env/exeris-community-runtime.env",
  "transport_mode": "loopback-h1",
  "target": {
    "tier": "community",
    "repo": "exeris-community",
    "protocol": "h1",
    "mode": "pure",
    "commit_sha": "be2330ffa80abd27c6da34df31bc6c19146aa6de",
    "build_provenance": {
      "artifact_path": "/home/bench/exeris-benchmarks/targets/exeris-community-app/target/exeris-community-app-1.0.0-SNAPSHOT.jar",
      "artifact_sha256": "18a637aaf528bcca863978a94a356f9b597dca280aa2aa0082a963daa12aadf6"
    }
  },
  "run_config": {
    "duration_seconds": 120,
    "warmup_seconds": 60,
    "threads": 4,
    "connections": 128,
    "contract_id": "fixed_contract_p99_stable_h1_wrk2_v1",
    "protocol_mode": "h1",
    "transport_mode": "loopback-h1",
    "track_id": "track-ba-01",
    "pair_id": "entity-read-by-id-fixed_contract_p99_stable_h1_wrk2_v1-exeris-community__quarkus-hibernate",
    "pair_order": "ba",
    "ab_ba_orders_completed": [
      "ab",
      "ba"
    ],
    "pair_completion_evidence": {
      "invocation_order": "ba",
      "target_slot": "target-a",
      "completion_marker_utc": "2026-07-22T21:42:21Z",
      "completed_orders": [
        "ab",
        "ba"
      ]
    },
    "jvm_class": "jvm",
    "mode": "pure",
    "driver": {
      "mode": "open",
      "offered_rps": 4000,
      "rate_attainment_pct": 99.75,
      "note": "closed = wrk at saturation: throughput and resource metrics valid, percentiles are queue-depth/throughput. open = wrk2 at a fixed arrival rate: percentiles are service time."
    },
    "payload_size_bytes": 1024,
    "drift_snapshot": {
      "required_metadata_present": true,
      "max_latency_drift_pct": 0,
      "observed_latency_drift_pct": 0,
      "max_throughput_drift_pct": 0,
      "observed_throughput_drift_pct": 0
    },
    "metadata": {
      "jdk_vendor": "Eclipse Adoptium",
      "jdk_version": "26.0.1",
      "benchmark_tool_version": "wrk debian/4.1.0-4build2 [epoll] Copyright (C) 2012 Will Glozer",
      "jvm_flags": [
        "jvm-defaults-no-explicit-launcher-flags"
      ],
      "hardware_profile": "perf-box-amd64",
      "backend_network_mode": "bridge",
      "scenario_id": "entity-read-by-id",
      "target_classification": "runtime-comparative"
    },
    "pinned_versions": {
      "jdk_version": "26.0.1",
      "benchmark_tool_version": "wrk debian/4.1.0-4build2 [epoll] Copyright (C) 2012 Will Glozer",
      "target_commit_sha": "be2330ffa80abd27c6da34df31bc6c19146aa6de"
    },
    "actual_versions": {
      "jdk_version": "26.0.1",
      "benchmark_tool_version": "wrk debian/4.1.0-4build2 [epoll] Copyright (C) 2012 Will Glozer",
      "target_commit_sha": "be2330ffa80abd27c6da34df31bc6c19146aa6de"
    },
    "target_contract": {
      "target_id": "exeris-community",
      "tier": "community",
      "protocol_mode": "h1",
      "launcher_mode": "external",
      "env_file": "/home/bench/exeris-benchmarks/runtime/drivers/env/exeris-community-runtime.env",
      "profile_id": "exeris-community",
      "compose_file": "",
      "jar_path": "",
      "health_url": "http://localhost:9000/health"
    },
    "resource_metrics": {
      "sample_count": 118,
      "cpu_time_seconds": 184.49,
      "cpu_util_percent_of_one_core": 153.74,
      "avg_cores_used": 1.5374,
      "host_logical_cpus": 16,
      "cpu_util_percent_of_host_total": 9.61,
      "vmrss_kb_min": 548348,
      "vmrss_kb_max": 551108,
      "vmrss_kb_avg": 550304,
      "vmsize_kb_min": 7221188,
      "vmsize_kb_max": 7221188,
      "vmsize_kb_avg": 7221188,
      "vmhwm_kb_max": 551108,
      "threads_min": 72,
      "threads_max": 77,
      "threads_avg": 72.36,
      "smaps_rss_kb_min": 548348,
      "smaps_rss_kb_max": 551108,
      "smaps_rss_kb_avg": 550304,
      "cgroup_memory_current_kb_min": 5694428,
      "cgroup_memory_current_kb_max": 5812916,
      "cgroup_memory_current_kb_avg": 5756944,
      "rss_kb_min": 548348,
      "rss_kb_max": 551108,
      "rss_kb_avg": 550304,
      "jvm_memory_breakdown": {
        "jcmd_available": true,
        "jcmd_heap_info_succeeded": true,
        "heap_metrics_present": false,
        "breakdown_valid": true,
        "breakdown_note": "NMT breakdown present; heap_committed_kb backfilled from NMT after partial GC.heap_info parse.",
        "heap_used_kb": 0,
        "heap_committed_kb": 262144,
        "heap_max_kb": 0,
        "native_total_committed_kb": 435354,
        "native_total_reserved_kb": 1828490,
        "native_java_heap_committed_kb": 262144,
        "offheap_kb_estimate": 173210,
        "heap_plus_offheap_kb_estimate": 173210,
        "offheap_estimate_source": "nmt_minus_java_heap",
        "nmt_enabled": true
      }
    },
    "jfr_capture": {
      "pid": "3120353",
      "jcmd_available": true,
      "check_ok": true,
      "recording_detected": true,
      "dump_attempted": true,
      "dump_success": true,
      "stop_attempted": false,
      "stop_success": false,
      "stop_recording_name": "",
      "jfr_file": "results/raw/entity-read-by-id/20260722-203502-latency-curve-triad/heavy/rung-4000rps/2-exeris-vs-quarkus-hibernate/run01/ba/target-a/target-exeris-community-20260722-213555.jfr",
      "note": "jfr stop skipped: recording ownership not from this run"
    },
    "runtime_log": {
      "launcher_mode": "external",
      "env_file": "/home/bench/exeris-benchmarks/runtime/drivers/env/exeris-community-runtime.env",
      "log_path": "/tmp/exeris-community.log",
      "external_jar_path": "targets/exeris-community-app/target/exeris-community-app-1.0.0-SNAPSHOT.jar",
      "resolved_jar_path": "/home/bench/exeris-benchmarks/targets/exeris-community-app/target/exeris-community-app-1.0.0-SNAPSHOT.jar",
      "jar_exists": true,
      "jar_sha256": "18a637aaf528bcca863978a94a356f9b597dca280aa2aa0082a963daa12aadf6",
      "jar_size_bytes": 20569065,
      "jar_mtime_utc": "2026-07-22T21:15:46Z",
      "copied": true,
      "output_file": "results/raw/entity-read-by-id/20260722-203502-latency-curve-triad/heavy/rung-4000rps/2-exeris-vs-quarkus-hibernate/run01/ba/target-a/target-runtime.log",
      "note": "runtime log copied"
    },
    "jfr_start": {
      "pid": "3120353",
      "jcmd_available": true,
      "start_attempted": false,
      "start_success": true,
      "recording_already_present": true,
      "recording_name": "exeris_community_20260722_213555",
      "note": "recording already present"
    }
  },
  "metrics": {
    "throughput_rps": 3989.86,
    "latency_p50_us": 1740.000000,
    "latency_p75_us": 2680.000000,
    "latency_p90_us": 3880.000000,
    "latency_p95_us": 4339.000000,
    "latency_p99_us": 5050.000000,
    "error_rate_pct": 0.0000,
    "total_requests": 478821,
    "total_errors": 0,
    "socket_errors": {
      "connect": 0,
      "read": 0,
      "write": 0,
      "timeout": 0,
      "total": 0
    },
    "failed_requests_total": 0,
    "failed_request_rate_pct": 0.0000,
    "latency_p999_us": 6030.000000
  },
  "claim_scope": "comparison_eligible",
  "runner_status": "success",
  "final_reason": "ok",
  "reproducibility_status": "complete"
}
