{
  "schema_version": "1",
  "run_id": "entity-read-by-id-20260723-023039-000000",
  "timestamp": "2026-07-23T02:37:04Z",
  "scenario": "entity-read-by-id",
  "tool": "wrk",
  "env_ref": "/home/bench/exeris-benchmarks/runtime/drivers/env/quarkus-runtime.env",
  "transport_mode": "loopback-h1",
  "target": {
    "tier": "community",
    "repo": "quarkus-hibernate",
    "protocol": "h1",
    "mode": "pure",
    "commit_sha": "be2330ffa80abd27c6da34df31bc6c19146aa6de",
    "build_provenance": {
      "artifact_path": "/home/bench/exeris-benchmarks/targets/quarkus-benchmark-app/target/quarkus-benchmark-app-1.0.0-SNAPSHOT-runner.jar",
      "artifact_sha256": "078f452cda7c677e1f1e684153a369c9a56833a0dc2d9d23e51292d1c5b002a1"
    }
  },
  "run_config": {
    "duration_seconds": 120,
    "warmup_seconds": 60,
    "threads": 4,
    "connections": 128,
    "contract_id": "fixed_contract_p99_stable_h1_wrk2_single_read_v1",
    "protocol_mode": "h1",
    "transport_mode": "loopback-h1",
    "track_id": "track-ba-01",
    "pair_id": "entity-read-by-id-fixed_contract_p99_stable_h1_wrk2_single_read_v1-quarkus-hibernate__quarkus-tuned",
    "pair_order": "ba",
    "ab_ba_orders_completed": [
      "ab",
      "ba"
    ],
    "pair_completion_evidence": {
      "invocation_order": "ba",
      "target_slot": "target-a",
      "completion_marker_utc": "2026-07-23T02:37:04Z",
      "completed_orders": [
        "ab",
        "ba"
      ]
    },
    "jvm_class": "jvm",
    "mode": "pure",
    "driver": {
      "mode": "open",
      "offered_rps": 20000,
      "rate_attainment_pct": 99.94,
      "note": "closed = wrk at saturation: throughput and resource metrics valid, percentiles are queue-depth/throughput. open = wrk2 at a fixed arrival rate: percentiles are service time."
    },
    "payload_size_bytes": 1024,
    "drift_snapshot": {
      "required_metadata_present": true,
      "max_latency_drift_pct": 0,
      "observed_latency_drift_pct": 0,
      "max_throughput_drift_pct": 0,
      "observed_throughput_drift_pct": 0
    },
    "metadata": {
      "jdk_vendor": "Eclipse Adoptium",
      "jdk_version": "26.0.1",
      "benchmark_tool_version": "wrk debian/4.1.0-4build2 [epoll] Copyright (C) 2012 Will Glozer",
      "jvm_flags": [
        "jvm-defaults-no-explicit-launcher-flags"
      ],
      "hardware_profile": "perf-box-amd64",
      "backend_network_mode": "bridge",
      "scenario_id": "entity-read-by-id",
      "target_classification": "runtime-comparative"
    },
    "pinned_versions": {
      "jdk_version": "26.0.1",
      "benchmark_tool_version": "wrk debian/4.1.0-4build2 [epoll] Copyright (C) 2012 Will Glozer",
      "target_commit_sha": "be2330ffa80abd27c6da34df31bc6c19146aa6de"
    },
    "actual_versions": {
      "jdk_version": "26.0.1",
      "benchmark_tool_version": "wrk debian/4.1.0-4build2 [epoll] Copyright (C) 2012 Will Glozer",
      "target_commit_sha": "be2330ffa80abd27c6da34df31bc6c19146aa6de"
    },
    "target_contract": {
      "target_id": "quarkus-hibernate",
      "tier": "community",
      "protocol_mode": "h1",
      "launcher_mode": "external",
      "env_file": "/home/bench/exeris-benchmarks/runtime/drivers/env/quarkus-runtime.env",
      "profile_id": "quarkus-hibernate",
      "compose_file": "",
      "jar_path": "",
      "health_url": "http://localhost:9002/health"
    },
    "resource_metrics": {
      "sample_count": 116,
      "cpu_time_seconds": 358.37,
      "cpu_util_percent_of_one_core": 298.64,
      "avg_cores_used": 2.9864,
      "host_logical_cpus": 16,
      "cpu_util_percent_of_host_total": 18.66,
      "vmrss_kb_min": 1342588,
      "vmrss_kb_max": 1356220,
      "vmrss_kb_avg": 1355335,
      "vmsize_kb_min": 8018252,
      "vmsize_kb_max": 8018252,
      "vmsize_kb_avg": 8018252,
      "vmhwm_kb_max": 1356220,
      "threads_min": 66,
      "threads_max": 73,
      "threads_avg": 66.46,
      "smaps_rss_kb_min": 1342588,
      "smaps_rss_kb_max": 1356220,
      "smaps_rss_kb_avg": 1355335,
      "cgroup_memory_current_kb_min": 48670892,
      "cgroup_memory_current_kb_max": 48694744,
      "cgroup_memory_current_kb_avg": 48688995,
      "rss_kb_min": 1342588,
      "rss_kb_max": 1356220,
      "rss_kb_avg": 1355335,
      "jvm_memory_breakdown": {
        "jcmd_available": true,
        "jcmd_heap_info_succeeded": true,
        "heap_metrics_present": false,
        "breakdown_valid": true,
        "breakdown_note": "NMT breakdown present; heap_committed_kb backfilled from NMT after partial GC.heap_info parse.",
        "heap_used_kb": 0,
        "heap_committed_kb": 1310720,
        "heap_max_kb": 0,
        "native_total_committed_kb": 1571866,
        "native_total_reserved_kb": 2911706,
        "native_java_heap_committed_kb": 1310720,
        "offheap_kb_estimate": 261146,
        "heap_plus_offheap_kb_estimate": 261146,
        "offheap_estimate_source": "nmt_minus_java_heap",
        "nmt_enabled": true
      }
    },
    "jfr_capture": {
      "pid": "3667051",
      "jcmd_available": true,
      "check_ok": true,
      "recording_detected": true,
      "dump_attempted": true,
      "dump_success": true,
      "stop_attempted": false,
      "stop_success": false,
      "stop_recording_name": "",
      "jfr_file": "results/raw/entity-read-by-id/20260722-203502-latency-curve-triad/light/rung-20000rps/3-quarkus-hibernate-vs-tuned/run01/ba/target-a/target-quarkus-hibernate-20260723-023039.jfr",
      "note": "jfr stop skipped: recording ownership not from this run"
    },
    "runtime_log": {
      "launcher_mode": "external",
      "env_file": "/home/bench/exeris-benchmarks/runtime/drivers/env/quarkus-runtime.env",
      "log_path": "/tmp/exeris-quarkus-9002.log",
      "external_jar_path": "targets/quarkus-benchmark-app/target/quarkus-benchmark-app-1.0.0-SNAPSHOT-runner.jar",
      "resolved_jar_path": "/home/bench/exeris-benchmarks/targets/quarkus-benchmark-app/target/quarkus-benchmark-app-1.0.0-SNAPSHOT-runner.jar",
      "jar_exists": true,
      "jar_sha256": "078f452cda7c677e1f1e684153a369c9a56833a0dc2d9d23e51292d1c5b002a1",
      "jar_size_bytes": 75907313,
      "jar_mtime_utc": "2026-07-23T01:57:00Z",
      "copied": true,
      "output_file": "results/raw/entity-read-by-id/20260722-203502-latency-curve-triad/light/rung-20000rps/3-quarkus-hibernate-vs-tuned/run01/ba/target-a/target-runtime.log",
      "note": "runtime log copied"
    },
    "jfr_start": {
      "pid": "3667051",
      "jcmd_available": true,
      "start_attempted": false,
      "start_success": true,
      "recording_already_present": true,
      "recording_name": "quarkus_hibernate_20260723_023039",
      "note": "recording already present"
    }
  },
  "metrics": {
    "throughput_rps": 19987.33,
    "latency_p50_us": 1040.000000,
    "latency_p75_us": 1400.000000,
    "latency_p90_us": 1670.000000,
    "latency_p95_us": 1828.000000,
    "latency_p99_us": 2180.000000,
    "error_rate_pct": 0.0000,
    "total_requests": 2398495,
    "total_errors": 0,
    "socket_errors": {
      "connect": 0,
      "read": 0,
      "write": 0,
      "timeout": 0,
      "total": 0
    },
    "failed_requests_total": 0,
    "failed_request_rate_pct": 0.0000,
    "latency_p999_us": 7640.000000
  },
  "claim_scope": "comparison_eligible",
  "runner_status": "success",
  "final_reason": "ok",
  "reproducibility_status": "complete"
}
